text_id,text
1,"During European contact in 1492, Caribbean islands were densely populated by different indigenous groups. Recent scholarly research has investigated the origins and evolution of the islands' populations over the entire period. At the beginning of the current geological epoch, the Holocene era, the northern part of South America was occupied by groups of small-game hunters, fishers, and foragers. These groups occasionally resided in semi-permanent campsites while mostly being mobile to use a wide range of plant and animal resources in various habitats. Archaeological evidence suggests that Trinidad was the first Caribbean island settled as early as 9000/8000 BCE. However, the first settlers most likely arrived in Trinidad when it was still attached to South America by land bridges.[2] It was not until about 7000/6000 BCE, during the early Holocene that Trinidad became an island rather than part of the mainland due to a significant jump in sea level by about 60 m., which may be attributable to climate change. The conclusion is that Trinidad was the only Caribbean Island that could have been colonized by Indigenous people from the South American mainland by not traversing hundreds or thousands of kilometers of the open sea.[3] The earliest major habitation sites discovered in Trinidad are the shell midden deposits of Banwari Trace and St. John, which have been dated between 6000 and 5100 BCE. Both shell middens represent extended deposits of shells discarded by human populations utilizing the crustaceans as a food source and stone and bone tools.[4] They are considered to belong to the Ortoiroid archaeological tradition, named after the similar but much more recent Ortoire site in Mayaro, Trinidad. Scholars have attempted to classify Caribbean prehistory into different ages, a difficult and controversial task.[5] In the 1970s archaeologist Irving Rouse defined three ages to classify Caribbean prehistory: the Lithic, Archaic and Ceramic Age, based on archaeological evidence.[6] Current literature on Caribbean prehistory still uses these three terms, but, there is much dispute regarding their usefulness and definition. In general, the Lithic Age is considered the first era of human development in the Americas and the period where stone chipping was first practiced. The ensuing Archaic age is often defined by specialized subsistence adaptions, combining hunting, fishing, collecting and the managing of wild food plants. Ceramic Age communities manufactured ceramic and made use of small-scale agriculture. Except for Trinidad, the first Caribbean islands were settled during the Archaic Age between 3500 and 3000 BCE. Archaeological sites of this period have been located in Barbados, Cuba, Curaçao and St. Martin, followed closely by Hispaniola and Puerto Rico.[10] This settlement phase is often attributed to the Ortoiroid culture. Between 800 and 200 BCE a new migratory group expanded through the Caribbean island: the Saladoid.[11] This group is named after the Saladero site in Venezuela, where their distinctive pottery (typically distinguished by white-on-red painted designs) was first identified. The introduction of pottery and plant domestication to the Caribbean is often attributed to Saladoid groups and is considered the beginning of the Ceramic Age. However, recent studies have revealed that crops and pottery were already present in some Archaic Caribbean populations before the arrival of the Saladoid.[13] Although a large number of Caribbean Islands were settled during the Archaic and Ceramic Ages, some islands were presumably visited much later. Jamaica has no known settlements until around 600 CE while the Cayman Islands show no evidence of settlement before European arrival. Following the colonization of Trinidad, it was originally proposed that Saladoid groups island-hopped their way to Puerto Rico, but current research tends to move away from this stepping-stone model[15] in favor of the southward route hypothesis. The southward route hypothesis proposes that the northern Antilles were settled directly from South America followed by progressively southward movements into the Lesser Antilles. This hypothesis has been supported by both radiocarbon dates and seafaring simulations.One initial impetus of movement from the mainland to the northern Antilles may have been the search for high quality materials such as flint. Flinty Bay on Antigua, is one of the best-known sources of high-quality flint in the Lesser Antilles. The presence of flint from Antigua on many other Caribbean Islands highlights the importance of this material during the Pre-Contact period. The period from 650 to 800 CE saw major cultural, socio-political and ritual reformulations, which took place both on the mainland and in many Caribbean islands.[18] The Saladoid interaction sphere disintegrated rapidly. This period is characterized with a change in climate. Centuries of abundant rainfall were replaced by prolonged droughts and increased frequency of hurricanes. In general, the Caribbean population increased, with communities changing from scattered single villages to the creation of settlement clusters. Agricultural activity increased. Analysis of cultural material has also shown the development of tighter networks between islands during the post-Saladoid period. The period after 800 CE can be seen as a period of transition in which status differentiation and hierarchically ranked society evolved, identified by a shift from achieved to ascribed leadership.[20] After about 1200 CE this process was interrupted by the absorption of many Caribbean settlements into the evolving socio-political structure of the Greater Antillean society. This process disrupted more-or-less independent lines of development of local communities and marked the beginnings of sociopolitical changes on a much larger scale. At the time of the European arrival, three major groups of indigenous peoples lived on the islands: the Taíno (sometimes also referred to as Arawak) in the Greater Antilles, the Bahamas and the Leeward Islands; the Kalinago and Galibi in the Windward Islands; and the Ciboney in western Cuba. Scholars have divided Taínos into Classic Taínos, who occupied Hispaniola and Puerto Rico, Western Taínos, who occupied Cuba, Jamaica, and the Bahamian archipelago, and the Eastern Taínos, who occupied the Leeward Islands.[21] Trinidad was inhabited by both Carib speaking and Arawak-speaking groups. DNA studies changed some of the traditional understandings of pre-Contact indigenous history. In 2003, a geneticist from the University of Puerto Rico at Mayagüez, Juan Martínez Cruzado, designed an island-wide DNA survey of Puerto Rico's modern population. The received understanding of the profile of Puerto Ricans' ancestry has been as mainly having Spanish ethnic origins, with some African ancestry, and distant and less significant indigenous ancestry. Martínez Cruzado's research revealed that 61% of all Puerto Ricans have Amerindian mitochondrial DNA, 27% have African and 12% Caucasian.[22] According to National Geographic, Among the surprising findings is that most of the Caribbean’s original inhabitants may have been wiped out by South American newcomers a thousand years before the Spanish invasion that began in 1492. Moreover, indigenous populations of islands like Puerto Rico and Hispaniola were likely far smaller at the time of the Spanish arrival than previously thought." 

2,"after the voyages of Christopher Columbus to the Americas in 1492, both Portuguese and Spanish ships began claiming territories in Central and South America. These colonies brought in gold, and other European powers, most specifically the English, Dutch and French, hoped to establish profitable colonies of their own. Imperial rivalries made the Caribbean a contested area during European wars for centuries. In the Spanish American wars of independence in the early nineteenth century, most of Spanish America broke away from the Spanish Empire, but Cuba and Puerto Rico remained under the Spanish crown until the Spanish–American War of 1898. The Spanish encounter with lands and peoples unknown to them before the 1492 began with the first voyage of Genoese mariner Christopher Columbus, sailing under license from Queen Isabel I of Castile. Permanent Spanish settlement began in 1493. The first quarter century of Spanish settlement in the Caribbean set enduring patterns that were to be replicated throughout the Americas. After the Spanish conquest of the Aztec empire and the subsequent conquest of Peru with their dense indigenous populations organized in high civilizations and the discovery of rich deposits of precious metals, the Caribbean ceased to be the primary focus of the Spanish Empire in the Americas. But the administrative, social, and cultural patterns the Spanish set in the Caribbean were enduring. Spanish contact and exploitation of the indigenous peoples of the Caribbean had devastating consequences for the natives. Natives' deaths through disease and overwork prompted in Spanish settlers' search for indigenous labor on other Caribbean islands, resulting in the enslavement of natives and their transportation to the islands of Spanish settlement. Most saliently, the crown considered the indigenous population their new vassals and the crown attempted to stem the precipitous loss of indigenous population and settlers' enslavement and maltreatment of the indigenous population by enacting laws to curb settlers' exploitative activities. During Columbus's first voyage of exploration in 1492, he made contact with the Lucayans, whom he called Indians (indios) in the Bahamas and the Taíno in Cuba and the northern coast of Hispaniola. Starting with his second voyage in 1493, Spaniards came to settle permanently in the region dubbed The Indies. Spaniards saw evidence of gold deposits when seeing natives' gold personal ornaments enticing the Spanish search for wealth. Although Spain claimed the entire Caribbean and concluded the Treaty of Tordesillas (1494) with Portugal that divided the world between the two monarchies, Spaniards settled only the larger islands of Hispaniola (now the Dominican Republic) (1493), where they founded the permanent settlement of Santo Domingo. The Spanish later founded settlements on Martinica (1502); Puerto Rico (1508); Jamaica (1509); Cuba (1511); and Trinidad (1530), and the small 'pearl islands' of Cubagua and Margarita off the Venezuelan coast because of their valuable pearl beds, which were worked extensively between 1508 and 1530. The Spanish settled permanently in the Caribbean, establishing as far as possible lives similar or better than what they had in Iberia. Unlike the Portuguese pattern of expansion that created a series of small trading posts or forts, Spaniards' expectation was to create Spanish-style cities with permanent residents. They expected to use forced labor of the indigenous population to make European settlement not only possible but also profitable. Spaniards required the natives produce food for European settlers, putting strain on agriculture that did not generally produce major surpluses. Spaniards took it as their right to force the indigenous to labor for them in enterprises often far from natives' home villages. The allocation of labor to individual Spanish settlers was via grants, called encomiendas; the holders of these grants, encomenderos set indigenous to search for deposits of gold and mine it. The most famous account of the abuses and exploitation was by Dominican friar Bartolomé de las Casas, who influenced the Spanish crown to create laws to end the abuses and to attempt to stem the precipitous plunge of the indigenous populations. To supplement and then replace the dwindling indigenous labor force, the Spanish transported enslaved Africans to the Caribbean to work on plantations cultivating cane sugar, a high-value export product. Spaniards continued their explorations of islands and the lands around the Caribbean Sea in search of sources of dense indigenous populations and material wealth. The expedition of Spanish settler on Cuba, Hernán Cortés, resulted in Spanish conquest of the Aztec Empire in 1521, which shifted the crown's focus to Mexico."

3,"Although the Caribbean remained strategically important for the Spanish Empire, other European powers established a presence in the Caribbean after Spain's main interest turned toward Mexico and Peru, where there were dense indigenous populations that could be forced to labor and where there were rich deposits of silver. The Dutch, the French and the English conquered islands claimed by Spain but not effectively controlled. For European powers without colonies in the Americas, the islands presented possibilities for commercial development of sugar plantations on the model established by the Spanish, using enslaved African laborers. Also important was that the islands could serve as bases for trade and piracy in the region. Piracy in the Caribbean was widespread during the colonial era, especially between 1640 and 1680. The term buccaneer is often used to describe a pirate operating in this region.Francis Drake was an English privateer who attacked many Spanish settlements. His most celebrated Caribbean exploit was the capture of the Spanish Silver Train at Nombre de Dios in March 1573. British colonization of Bermuda began in 1612. British West Indian colonization began with Saint Kitts in 1623 and Barbados in 1627. The former was used as a base for British colonization of neighboring Nevis (1628), Antigua (1632),[28] Montserrat (1632), Anguilla (1650) and Tortola (1672). French colonization too began on St. Kitts, the British and the French splitting the island amongst themselves in 1625. It was used as a base to colonize the much larger Guadeloupe (1635) and Martinique (1635), St. Martin (1648), St Barts (1648), and St Croix (1650), but was lost completely to Britain in 1713. From Martinique the French colonized St. Lucia (1643), Grenada (1649), Dominica (1715), and St. Vincent (1719). English admiral William Penn seized Jamaica in 1655 and it remained under British rule for over 300 years. In 1625 French buccaneers established a settlement on Tortuga, just to the north of Hispaniola, that the Spanish were never able to permanently destroy despite several attempts. The settlement on Tortuga was officially established in 1659 under the commission of King Louis XIV. In 1670 Cap François (later Cap Français, now Cap-Haïtien) was established on the mainland of Hispaniola. Under the 1697 Treaty of Ryswick, Spain officially ceded the western third of Hispaniola[30][31] to France.[32]
The Dutch took over Saba, Saint Martin, Sint Eustatius, Curaçao, Bonaire, Aruba,[33] Tobago, St. Croix, Tortola, Anegada, Virgin Gorda, Anguilla and a short time Puerto Rico, together called the Dutch West Indies, in the 17th century.
Denmark-Norway first ruled part, then all of the present U.S. Virgin Islands since 1672, Denmark sold sovereignty over the Danish West Indies in 1917 to the United States, of which they are still a part. During the first three-quarters of the sixteenth century, matters of balance of power and dynastic succession weighed heavily on the course of European diplomacy and war. Europe's largest and most powerful kingdoms, France and Spain, were the continent's fierce rivals. Tensions increased after 1516, when the kingdoms of Castile, León, and Aragon were ruled by Charles V as his inheritance from his maternal grandparents Isabel I of Castile and Ferdinand II of Aragon and his mother, Queen Joan. Three years later expanded Charles domains after his election as Holy Roman Emperor and the territories he held as his personal empire surrounded France. In 1521, France went to war with the Holy Roman Empire. Spanish troops routed French armies in France, the Italian Peninsula, and elsewhere, forcing the French Crown to surrender in 1526 and again in 1529. The Italian Wars, as the French-Spanish wars came to be known, reignited in 1536 and again in 1542. Intermittent warring between the Valois monarchy and the Habsburg Empire continued until 1559, when Charles abdicated and retired to a monastery after dividing his realms. French corsair attacks began in the early 1520s, as soon as France declared war on Spain in 1521, the year Hernán Cortés defeated the Aztecs. Prodigious treasures from Mexico began to cross the Atlantic en route to Spain. French monarch Francis I challenged Spain's exclusivist claims to the New World and its wealth, demanding to see the clause in Adam’s will which excluded me from my share when the world was being divided. Giovanni da Verrazzano (aka Jean Florin) led the first recorded French corsair attack against Spanish vessels carrying treasures from the New World. In 1523, off the Cape of St. Vincent, Portugal, his vessels captured two Spanish ships laden with a fabulous treasure consisting of 70,000 ducats worth of gold, large quantities of silver and pearls, and 25,000 pounds of sugar, a much-treasured commodity at the time. The first recorded incursion in the Caribbean happened in 1528, when a lone French corsair vessel appeared off the coast of Santo Domingo and its crew sacked the village of San Germán on the western coast of Puerto Rico. In the mid-1530s, corsairs, some Catholic but most of them Protestant (Huguenot), began routinely attacking Spanish vessels and raiding Caribbean ports and coastal towns; the most coveted were Santo Domingo, Havana, Santiago, and San Germán. Corsair port raids in Cuba and elsewhere in the region usually followed the rescate (ransom) model, whereby the aggressors seized villages and cities, kidnapped local residents, and demanded payment for their release. If there were no hostages, corsairs demanded ransoms in exchange for sparing towns from destruction. Whether ransoms were paid or not, corsairs looted and frequently committed acts of violence against their victims, desecrated churches and holy images, and left smoldering reminders of their incursions. In 1536, France and Spain went to war again and French corsairs launched a series of attacks on Spanish Caribbean settlements and ships. The next year, a corsair vessel appeared in Havana and demanded a 700-ducat rescate. Spanish men-of-war arrived soon and scared off the intruding vessel, which returned soon thereafter to demand yet another rescate. Santiago was also victim of an attack that year, and both cities endured raids yet again in 1538. The waters off Cuba's northwest became particularly attractive to pirates as commercial vessels returning to Spain had to squeeze through the 90-mile-long strait between Key West and Havana. In 1537–1538, corsairs captured and sacked nine Spanish vessels. While France and Spain were at peace until 1542, beyond-the-line corsair activity continued. When war erupted again, it echoed once more in the Caribbean. A particularly vicious French corsair attack took place in Havana in 1543. It left a gory toll of 200 killed Spanish settlers. In all, between 1535 and 1563, French corsairs carried out around sixty attacks against Spanish settlements and captured over seventeen Spanish vessels in the region (1536–1547)."

